{
  "schema_version": "1.0",
  "feature_id": "article-lifecycle",
  "input_mode": "integrated",
  "feature_spec_path": "Assignment 01/codebases/realworld/specification/features/article-lifecycle.md",
  "structured_requirements_path": "Assignment 02/data/structured-requirements/article-lifecycle.json",
  "risk_analysis_path": "Assignment 02/data/risk-analysis/article-lifecycle.json",
  "review_context": {
    "revision": 0,
    "designer_revisions_path": null
  }
}
